<?xml version="1.0" encoding="UTF-8" standalone="yes"?>
<?xml-stylesheet href="catalog_20048939.css" type="text/css"?>

<store xmlns:xsi="http://www.w3.org/2001/XMLSchema-instance" xsi:noNamespaceSchemaLocation="catalog_20048939.xsd">

    <!-- header section includes navigation bar -->
    <header>
        <store-logo-logo>
            <store-logo/>
            <store-name>GiftMandu</store-name>
        </store-logo-logo>
        <nav>
            <a href='#'>Home</a>
            <a href='#'>Services</a>
            <a href='#'>About</a>
            <a href='#'>Contact</a>
        </nav>
        <button>Login</button>
    </header>
    <!-- header setion ends -->

    <!-- home section includes landing page -->
    <home>
        <home-desc>Buy, Send &amp; Redeem Gift Cards Today!!!</home-desc>
        <icons><icon-amazon/><icon-google/><icon-apple/><icon-spotify/><icon-starbucks/><icon-xbox/></icons>    
    </home>
    <!-- end of home section -->

    <!-- gifcards section includes all-together 14 giftcards with its details -->
    <giftcards>
        <giftcard id="gc01amzn" company="Amazon" type="Online"> <!-- data type of the giftcard is set to ID, so id of the giftcard cannot repeat  -->
            <image/><!-- displays image of the gift card -->
            <giftcard-details>
                <giftcard-name>Amazon eGift Card</giftcard-name>
                <property-code>
                    <label>Card Code:</label>
                    <code-number>gc01amzn</code-number>
                </property-code>
                <property-type>
                    <label>Type:</label>
                    <type>Online</type>
                </property-type>
                <property-cost>
                    <label>Price: </label>
                    <cost currency="British Pound">38.48</cost><!-- default currency is set to British Pound -->
                </property-cost>
                <property-validity>
                    <label>Validity:</label>
                    <validity>2023-09-10</validity>
                </property-validity>
                <property-nou>
                    <label>Users:</label>
                    <number-of-users>1198</number-of-users>
                </property-nou>
                <property-rating>
                    <label>Rating:</label>
                    <rating>4.8</rating>
                </property-rating>
                <property-region>
                    <label>Available-in:</label>
                    <region>UK Only</region>
                </property-region>
                <property-stock>
                    <label>Stock:</label>
                    <stock stock-left="10">In stock</stock>
                </property-stock>
                <about-card>
                    <label>Description:</label>
                    <description is_returnable="no">
                    <![CDATA[This Gift Card can be used to buy millions of qualifying items and services from Amazon.com Services LLC and its affiliates on www.amazon.com or one of its connected sites, such as smile.amazon.com.]]></description>
                </about-card>
            </giftcard-details>
            <delivery>Free Delivery</delivery><!-- delivery element is optional, so it can be set on some selected gift cards -->
            <discount><!-- discount element is optional, so it can be set on some selected cards ie. discount is not compulsary for all gift cards -->
                <discount-percentage>10</discount-percentage>
                <label>% OFF</label>
            </discount>
        </giftcard>

        <giftcard id="gc02appl"  company="Apple" type="Online, Physical"> 
            <image/>
            <giftcard-details>
                <giftcard-name>Apple Gift Card</giftcard-name>
                <property-code>
                    <label>Card Code:</label>
                    <code-number>gc02appl</code-number>
                </property-code>
                <property-type>
                    <label>Type:</label>
                    <type>Online, Physical</type>
                </property-type>
                <property-cost>
                    <label>Price: </label>
                    <cost currency="British Pound">76.96</cost>
                </property-cost>
                <property-validity>
                    <label>Validity:</label>
                    <validity>2024-12-01</validity>
                </property-validity>
                <property-nou>
                    <label>Users:</label>
                    <number-of-users>23980</number-of-users>
                </property-nou>
                <property-rating>
                    <label>Rating:</label>
                    <rating>4.7</rating>
                </property-rating>
                <property-region>
                    <label>Available-in:</label>
                    <region>All Countries</region>
                </property-region>
                <property-stock>
                    <label>Stock:</label>
                    <stock stock-left="12">In stock</stock>
                </property-stock>
                <about-card>
                    <label>Description:</label>
                    <description is_returnable="no"><![CDATA[Purchase items and accessories with your Apple Gift Card at an Apple Store. You may also use it on the App Store to buy apps, subscriptions like Apple Music or iCloud+, and purchases from apple.com.]]></description>
                </about-card>
            </giftcard-details>
            <delivery>Free Delivery</delivery>
        </giftcard>

        <giftcard id="gc03bby" company="Best Buy" type="Physical"> 
            <image/>
            <giftcard-details>
                <giftcard-name>Best Buy Gift Card</giftcard-name>
                <property-code>
                    <label>Card Code:</label>
                    <code-number>gc03bby</code-number>
                </property-code>
                <property-type>
                    <label>Type:</label>
                    <type>Physical</type>
                </property-type>
                <property-cost>
                    <label>Price: </label>
                    <cost currency="British Pound">384.82</cost>
                </property-cost>
                <property-nou>
                    <label>Users:</label>
                    <number-of-users>12991</number-of-users>
                </property-nou>
                <property-rating>
                    <label>Rating:</label>
                    <rating>3.8</rating>
                </property-rating>
                <property-region>
                    <label>Available-in:</label>
                    <region>UK Only</region>
                </property-region>
                <property-stock>
                    <label>Stock:</label>
                    <stock stock-left="15">In stock</stock>
                </property-stock>
                <about-card>
                    <label>Description:</label>
                    <description is_returnable="no"><![CDATA[Gift cards from Best Buy can only be used to buy items and services in shops, as stated in the terms and restrictions.]]></description>
                </about-card>
            </giftcard-details>
            <discount>
                <discount-percentage>5</discount-percentage>
                <label>% OFF</label>
            </discount>
        </giftcard>

        <giftcard id="gc04eby" company="eBay" type="Online"> 
            <image/>
            <giftcard-details>
                <giftcard-name>eBay eGift Card</giftcard-name>
                <property-code>
                    <label>Card Code:</label>
                    <code-number>gc04eby</code-number>
                </property-code>
                <property-type>
                    <label>Type:</label>
                    <type>Online</type>
                </property-type>
                <property-cost>
                    <label>Price: </label>
                    <cost currency="British Pound">153.93</cost>
                </property-cost>
                <property-validity>
                    <label>Validity:</label>
                    <validity>2023-06-06</validity>
                </property-validity>
                <property-nou>
                    <label>Users:</label>
                    <number-of-users>34045</number-of-users>
                </property-nou>
                <property-rating>
                    <label>Rating:</label>
                    <rating>4.1</rating>
                </property-rating>
                <property-region>
                    <label>Available-in:</label>
                    <region>All Countries</region>
                </property-region>
                <property-stock>
                    <label>Stock:</label>
                    <stock stock-left="9">In stock</stock>
                </property-stock>
                <about-card>
                    <label>Description:</label>
                    <description is_returnable="no"><![CDATA[eBay Gift Cards are the Perfect Gift, Every Time.  Use the eBay Gift Card to shop from millions of items in Electronics, Toys, Motors, Fashion, Home & Garden, Art, Collectibles, Sporting Goods and everything in-between.]]></description>
                </about-card>
            </giftcard-details>
            <discount>
                <discount-percentage>20</discount-percentage>
                <label>% OFF</label>
            </discount>
        </giftcard>

        <giftcard id="gc05ggl" company="Google" type="Online"> 
            <image/>
            <giftcard-details>
                <giftcard-name>Google Play Gift Card</giftcard-name>
                <property-code>
                    <label>Card Code:</label>
                    <code-number>gc05ggl</code-number>
                </property-code>
                <property-type>
                    <label>Type:</label>
                    <type>Online</type>
                </property-type>